id,name,host_id,host_name,neighbourhood_group,neighbourhood,latitude,longitude,room_type,price,minimum_nights,number_of_reviews,last_review,reviews_per_month,calculated_host_listings_count,availability_365
40935222,Luxueus 1 slpk appartement in Hartje Antwerpen,274427263,Sorenco,,Stadspark,51.20952,4.4111,Entire home/apt,115,3,0,,,2,365
40938934,Gezellig appartement in hartje Antwerpen,318961195,Patrick,,Sint-Andries,51.21643,4.39793,Entire home/apt,58,1,12,2020-11-13,0.98,1,364
40945959,MUSAQILOFT,98837435,Katrien,,Brederode,51.20201,4.3956,Entire home/apt,160,2,0,,,1,0
40960005,"Ground Floor Apartment, near Three Parks",17886328,Alex,,Middelheim,51.18395,4.39702,Entire home/apt,49,4,2,2020-05-29,0.17,1,1
40985461,Central Perk Loft - Antwerp,314237238,Luc,,Stuivenberg,51.23142,4.42589,Entire home/apt,59,1,4,2020-02-02,0.33,2,180
40998197,Diamond Bourse apartment 1,67322181,Eli,,Centraal Station,51.21388,4.41758,Entire home/apt,100,1,2,2020-11-04,0.18,7,0
41018786,Diamond Bourse Apartment 2,67322181,Eli,,Centraal Station,51.21518,4.41755,Entire home/apt,136,1,2,2020-07-18,0.21,7,172
41023270,"Lovely & bright 2P apartment, Top location 't Zuid",65778049,David,,Zuid,51.20925,4.39815,Entire home/apt,45,13,17,2020-03-08,1.40,2,0
41045326,New Cosy Apartement in the heart of Antwerp,93455853,Pascal,,Theaterbuurt-Meir,51.21427,4.40382,Entire home/apt,90,2,2,2020-03-15,0.16,2,1
41060220,1 Master Bedroom in modern flat with shared spaces,19211847,Dieter,,Borgerhout Extra Muros,51.2014,4.44649,Private room,25,1,0,,,2,80
41094334,Light House Lodge Apartment in Center of Antwerp |,317037207,Elisabeth,,Historisch Centrum,51.22327,4.40258,Entire home/apt,63,1,3,2020-09-04,0.64,32,352
41094824,Apartment Light House In Historic Antwerp ||,317037207,Elisabeth,,Historisch Centrum,51.22122,4.40336,Entire home/apt,51,1,21,2020-10-18,1.97,32,353
41096855,Sunset View Lodge in the Center of Antwerp,317037207,Elisabeth,,Theaterbuurt-Meir,51.21863,4.41499,Entire home/apt,63,1,1,2020-09-03,0.25,32,1
41104073,Diamond City / Cidade dos diamantes,303761293,Elza,,Borgerhout Extra Muros,51.19876,4.44948,Private room,30,1,2,2020-12-24,0.72,1,180
41124839,Superior Cathedral Triplex Center of Antwerp.,317037207,Elisabeth,,Historisch Centrum,51.21977,4.40122,Entire home/apt,58,1,9,2020-12-17,1.00,32,296
41125450,Superior Cathedral Duplex Centre of Antwerp.,317037207,Elisabeth,,Historisch Centrum,51.21975,4.40114,Entire home/apt,63,1,9,2020-11-19,0.84,32,297
41126457,Theater Lodge Superior Apartment Central Antwerp,317037207,Elisabeth,,Theaterbuurt-Meir,51.21446,4.4086,Entire home/apt,64,1,6,2020-12-14,0.94,32,348
41128489,Theodore Luxury Lodge Centre of Antwerp,317037207,Elisabeth,,Sint-Andries,51.21675,4.39971,Entire home/apt,46,1,2,2020-07-05,0.20,32,336
41128925,Lily Apartment in the Heart of Antwerp,317037207,Elisabeth,,Theaterbuurt-Meir,51.21919,4.40934,Entire home/apt,64,1,2,2020-07-16,0.20,32,332
41129936,Penthouse Lodge In the Heart of Antwerp,317037207,Elisabeth,,Universiteitsbuurt,51.22011,4.40907,Entire home/apt,51,1,2,2020-10-26,0.19,32,357
41130318,The Grand Apartment on Best location in Antwerp,317037207,Elisabeth,,Historisch Centrum,51.21936,4.40378,Entire home/apt,64,1,5,2020-09-09,0.47,32,344
41140043,B&B in historisch stadscentrum.,5057775,Marcel,,Historisch Centrum,51.2229,4.40029,Private room,70,2,0,,,2,179
41141756,Marble Lodge Apartment in Heart of Antwerp 2A,317037207,Elisabeth,,Theaterbuurt-Meir,51.21865,4.40861,Entire home/apt,63,1,0,,,32,325
41143048,B&B midden in historisch stadscentrum.,5057775,Marcel,,Historisch Centrum,51.22295,4.39924,Private room,55,1,0,,,2,178
41145383,Marble Lodge Apartment in Heart of Antwerp 2D,317037207,Elisabeth,,Theaterbuurt-Meir,51.21748,4.40884,Entire home/apt,64,1,4,2020-11-19,0.38,32,354
41146273,Marble Lodge. Apartment in Heart of Antwerp 4F,317037207,Elisabeth,,Theaterbuurt-Meir,51.21684,4.40684,Entire home/apt,64,1,7,2020-10-10,0.70,32,352
41147763,Bright Stone Lodge Apartment Central Antwerp S1,317037207,Elisabeth,,Sint-Andries,51.21774,4.39952,Entire home/apt,63,1,7,2020-11-18,0.64,32,361
41148164,Greenplace Lodge Apartment in Heart Of Antwerp S2,317037207,Elisabeth,,Sint-Andries,51.21774,4.39952,Entire home/apt,63,1,5,2020-10-06,0.45,32,1
41148531,Greenplace Lodge Apartment in Heart of Antwerp S3,317037207,Elisabeth,,Sint-Andries,51.21658,4.40017,Entire home/apt,63,1,4,2020-10-07,0.38,32,330
41148846,Green Penthouse Apartment Heart of Antwerp S4,317037207,Elisabeth,,Historisch Centrum,51.21821,4.39896,Entire home/apt,63,1,4,2020-07-19,0.36,32,0
41149580,Luxury Three Bedroom Apartment Heart of Antwerp,317037207,Elisabeth,,Historisch Centrum,51.22416,4.40165,Entire home/apt,49,1,2,2020-04-18,0.18,32,277
41162320,Marble Luxury Lodge in the Heart of Antwerp 4E,317037207,Elisabeth,,Theaterbuurt-Meir,51.21824,4.40811,Entire home/apt,63,1,11,2020-12-12,1.08,32,330
41162976,Sunrise View Lodge In The Heart of Antwerp,317037207,Elisabeth,,Theaterbuurt-Meir,51.21828,4.4148,Entire home/apt,63,1,0,,,32,328
41207350,"GREAT apartment, ideal location!",13864274,Robin,,Zuid,51.21078,4.40112,Entire home/apt,80,2,14,2020-12-18,1.34,1,59
41224332,"Studio with free parking, kitchen, bathroom",42024170,Kristof,,Deurne Noord,51.23494,4.45371,Private room,28,1,50,2020-12-15,4.30,2,176
41225991,"Room in big loft in the citycenter, meirbuilding",318575095,Nikki,,Historisch Centrum,51.21902,4.40359,Private room,40,28,0,,,1,364
41227565,Cosy vintage design house+roof top terrace,26146741,Tinne,,Valaar,51.18095,4.37944,Entire home/apt,76,2,19,2020-12-30,1.83,2,333
41238604,Charming design apartment in city centre,47136718,Veerle,,Theaterbuurt-Meir,51.21567,4.40812,Entire home/apt,119,2,0,,,1,365
41241299,✨Mansha’s Apartment ✨,298729680,Priya,,Stadspark,51.20693,4.41891,Entire home/apt,70,2,10,2020-10-03,1.01,1,1
41261752,"Frisse, ruime kamer op het trendy Zuid",181019635,Marie,,Brederode,51.20413,4.40381,Private room,39,1,24,2020-12-22,2.22,1,0
41278743,Gezellige studio met terras!,15362842,Marijne,,Nieuw - Kwartier Oost,51.18524,4.44122,Entire home/apt,41,2,31,2020-11-30,2.66,1,157
41315958,Cozy bedroom in a spacious apartment w/terrace,14858728,Kate,,Theaterbuurt-Meir,51.21959,4.40645,Private room,45,1,4,2020-02-23,0.37,1,364
41373715,Spacious Apartments in the Center of Antwerp 3L,317037207,Elisabeth,,Theaterbuurt-Meir,51.21895,4.40858,Entire home/apt,64,1,6,2020-07-17,0.56,32,333
41388728,Spacious room next to central station of Antwerp,181853803,Mao-Ming,,Rivierenhof,51.2114,4.46286,Private room,33,30,3,2020-09-19,0.48,4,365
41391319,Cozy place with panoramic view near to city centre,6966957,,,Borgerhout Intra Muros Zuid,51.21103,4.43773,Private room,50,2,1,2020-03-15,0.10,1,178
41403056,Cosy studio in Antwerp's historic centre,10661360,Ivor,,Historisch Centrum,51.21796,4.40008,Entire home/apt,40,14,0,,,2,36
41440889,ANTWERP Stylish apartment nearby central park,261394719,Your,,Stadspark,51.21023,4.41394,Entire home/apt,130,4,4,2020-10-24,0.38,2,12
41482656,Apartment in the heart of Antwerp @Central Station,145687028,Sietse,,Centraal Station,51.21623,4.41971,Entire home/apt,175,1,4,2020-03-08,0.37,1,326
41500298,BoHo city Mansion (easy parking),138201030,Sumeyye,,Borgerhout Extra Muros,51.20979,4.4528,Entire home/apt,300,1,2,2020-03-15,0.19,5,60
41532692,Newly build design one bedroom apartment,103363284,Nathalie,,Eilandje,51.23046,4.41817,Entire home/apt,45,29,2,2020-11-15,0.21,8,0
41550993,PlaceToBe,327324964,Said,,Lambrechtshoeken,51.25669,4.43364,Private room,100,1,0,,,1,364
41562427,Antwerp ssSST.Michiel Apartment For a Longer Stay.,107062875,Carmen,,Sint-Andries,51.21559,4.39489,Entire home/apt,90,2,1,2020-01-26,0.09,1,180
41601800,Residencial Theodoro 6,202021039,Leonardo,,Borgerhout Intra Muros Noord,51.22224,4.44374,Private room,22,1,1,2020-02-05,0.09,5,89
41609768,Cosy new renovated Studio close to Antwerp Central,206908275,Margareta,,Haringrode,51.20568,4.41852,Entire home/apt,45,3,8,2020-12-23,1.62,1,193
41611567,Happy Backpackers 2,21046022,Arif,,Stuivenberg,51.22022,4.43487,Shared room,22,1,2,2020-09-25,0.37,3,165
41638347,Cosy apARTment in the suburbs,2822632,Ariane,,Hoogte,51.17552,4.40167,Entire home/apt,117,2,2,2020-02-09,0.18,2,90
41641334,New 2-bedroom condo in the heart of Antwerp,36688951,Tim,,Centraal Station,51.21654,4.41712,Entire home/apt,110,3,0,,,3,0
41641939,Another 2-bedroom condo in the heart of Antwerp,36688951,Tim,,Centraal Station,51.21649,4.41736,Entire home/apt,100,3,0,,,3,0
41655525,Trendy city Apartment - Antwerp South district,273986717,Jeroen,,Brederode,51.20486,4.40342,Entire home/apt,95,2,2,2020-02-16,0.18,1,1
41703665,A GOOD CHOICE !,79270852,Maryline,,Theaterbuurt-Meir,51.21962,4.40614,Entire home/apt,200,7,0,,,2,364
41705096,CHARMING & CENTRAL,79270852,Maryline,,Historisch Centrum,51.22011,4.40475,Private room,55,1,0,,,2,364
41755045,"Unique stay in an exclusive, historical building",329866092,Kevin,,Zuid,51.21031,4.39884,Entire home/apt,76,1,6,2020-05-17,0.56,1,286
41837646,Antwerpen Centraal Apartments 1,60219699,Eugene,,Centraal Station,51.21815,4.41906,Entire home/apt,80,2,1,2020-02-05,0.09,23,365
41838495,Antwerpen Centraal Apartments 2,60219699,Eugene,,Centraal Station,51.21791,4.4196,Entire home/apt,80,2,1,2020-03-06,0.10,23,365
41858866,Kasteel Boterlaerhof 39p,287169702,Johan,,Deurne Zuid Oost,51.21067,4.48124,Entire home/apt,990,1,0,,,3,364
41883830,Penthouse with spectacular views central Antwerp,331198702,Het,,Haringrode,51.20592,4.42073,Entire home/apt,160,1,1,2020-02-23,0.10,1,88
41924600,Golden Night,331692929,Lucyna,,Amandus - Atheneum,51.22729,4.42316,Entire home/apt,40,1,29,2020-12-10,2.64,1,177
41926978,Large furnished room near station of Antwerp,181853803,Mao-Ming,,Deurne Zuid West,51.21118,4.46054,Private room,33,30,2,2020-12-03,0.21,4,365
41930681,"Single bed room, at cosy, quiet flat.",23350766,Johan,,Borgerhout Intra Muros Noord,51.21637,4.43378,Private room,28,1,6,2020-03-16,0.54,2,333
41943993,Antwerpen appartement met uniek uitzicht!,331891913,Marc,,Eilandje,51.2301,4.41283,Entire home/apt,120,1,2,2020-08-30,0.38,1,179
41966968,Best opportunity for expats in Antwerpen 👌,60219699,Eugene,,Centraal Station,51.21857,4.41832,Entire home/apt,60,14,0,,,23,365
42011619,Apartment with a view,229182713,Julius,,Historisch Centrum,51.22636,4.40261,Entire home/apt,70,3,2,2020-03-09,0.19,2,0
42014359,Flat with mezzanine@OudeBeurs,332857725,Denis,,Historisch Centrum,51.22289,4.401,Entire home/apt,77,1,9,2020-08-23,0.84,2,365
42016903,LOVELY APPARTMENT! 10min from city !!,80706121,Manon,,Nieuw - Kwartier Oost,51.17795,4.43322,Entire home/apt,89,1,3,2020-11-02,0.30,1,260
42051549,"TOMORROWLAND BOOM, breakfast+driving service,house",26146741,Tinne,,Valaar,51.18255,4.37822,Entire home/apt,290,2,0,,,2,7
42054947,A cosy apartment 2 bedrooms 5 beds in the downtown,333335647,Yan,,Stadspark,51.21187,4.4103,Entire home/apt,90,3,1,2020-03-15,0.10,1,90
42067396,antwerpen studio op goede lokatie,292921497,Patrick,,Amandus - Atheneum,51.22324,4.421,Entire home/apt,30,2,4,2020-03-07,0.38,1,0
42094257,"Top located, cosy and very charming apartment",51258236,Nick,,Theaterbuurt-Meir,51.21135,4.40792,Entire home/apt,70,1,4,2020-08-24,0.39,1,273
42105269,Studio,328139466,Roksana,,Zuid,51.20586,4.39003,Entire home/apt,50,1,1,2020-02-13,0.09,1,179
42107733,Smartflats Diamant 2.1 - 2 Bedroom,2792958,Alex,,Centraal Station,51.21841,4.41992,Entire home/apt,187,1,1,2020-06-29,0.16,21,337
42107771,Smartflats Diamant 3.1 - 2 Bedroom,2792958,Alex,,Centraal Station,51.21761,4.41851,Entire home/apt,158,1,0,,,21,0
42107796,Smartflats Diamant 3.2 - 2 Bedroom Duplex,2792958,Alex,,Centraal Station,51.21755,4.41829,Entire home/apt,187,1,1,2020-07-22,0.19,21,355
42116437,Stijlvolle privé-kamer + badkamer nabij Antwerpen,26542495,Martijn,,Deurne Oost,51.21948,4.47199,Private room,35,1,1,2020-10-04,0.34,1,177
42126464,Diamond city apartment by central station Antwerp,306407095,Leo/Safet,,Centraal Station,51.21826,4.41701,Entire home/apt,80,2,27,2020-11-27,2.48,1,90
42167047,Antwerp Cosy Corner,44670168,David,,Theaterbuurt-Meir,51.21555,4.40685,Entire home/apt,27,1,3,2020-07-14,0.44,1,0
42174947,Cozy 2-Bedroom Apartment,73380435,Zehra-Viktoria,,Oud - Berchem,51.1961,4.42157,Entire home/apt,45,4,0,,,2,88
42192155,studio for 2,46918022,Evi,,Amandus - Atheneum,51.22889,4.42315,Entire home/apt,40,1,11,2020-11-17,1.94,6,1
42194629,Stylish loft studio of 44m2 in historical house,33809811,Katarina,,Harmonie,51.20779,4.40641,Entire home/apt,62,2,0,,,1,120
42263110,Charming townhouse close to the city centre,16290655,Stijn,,Stadspark,51.20689,4.41624,Entire home/apt,124,2,6,2020-08-22,0.59,1,0
42263835,Renovated flat with an amazing view near Antwerp!,121919008,Christophe,,Nieuw - Kwartier West,51.18049,4.43252,Private room,30,1,0,,,2,180
42293772,Cozy condo in hart of Antwerp,336068690,Douglas,,Amandus - Atheneum,51.22556,4.41772,Private room,37,1,4,2020-07-11,0.40,1,91
42306207,entire floor in cohousing-house,189196082,Bart,,Amandus - Atheneum,51.21769,4.42969,Private room,60,1,0,,,5,89
42308673,"Genuine, sunny teleworking space",254565300,Annelies,,Zurenborg,51.20856,4.4248,Entire home/apt,75,2,4,2020-07-22,0.56,1,0
42325792,Design loft near Antwerp city centre and De Roma,43256479,Miek,,Borgerhout Intra Muros Noord,51.2144,4.44071,Entire home/apt,65,2,7,2020-10-18,0.69,1,243
42341563,Cozy BoHo Antwerp appartement op 10min van Station,87790353,Steven,,Deurne Dorp - Gallifort,51.22125,4.45301,Entire home/apt,68,1,11,2020-12-28,1.88,1,324
42343860,Cozy and compact city home,150558275,Zeynep,,Historisch Centrum,51.22607,4.40481,Entire home/apt,79,1,2,2020-03-13,0.20,2,0
42386343,Luminous Longstay Appartment (City Center),17917685,Matthieu,,Universiteitsbuurt,51.22554,4.40522,Entire home/apt,29,15,0,,,1,291
42430344,Private Patio Apartment | Antiques | Atelier Wits,39001675,Guus,,Valaar,51.18186,4.38031,Entire home/apt,39,2,19,2020-11-22,1.94,3,0
42434024,Private Double Apartment | Antiques | Atelier Wits,39001675,Guus,,Kiel,51.18382,4.38195,Entire home/apt,43,2,12,2020-10-22,1.18,3,362
42442104,Apartment Anvers.,127787502,Olena,,Stadspark,51.20719,4.41229,Entire home/apt,82,1,8,2020-12-26,0.79,20,351
42451851,Home in the heart of Antwerp,49400312,Allison,,Sint-Andries,51.21786,4.39635,Entire home/apt,90,5,2,2020-08-31,0.20,1,0
42467845,Apartment for 4 persons (MM1),107750838,S.,,Hoboken - Zuidoost,51.17068,4.3646,Entire home/apt,170,3,0,,,35,365
42468911,Apartment for 4 persons (MM1),107750838,S.,,Hoboken - Zuidoost,51.16993,4.36355,Entire home/apt,170,3,0,,,35,363
42487950,Cosy apartment with terrace and Netflix+WIFI,51526840,Elke,,Borgerhout Intra Muros Zuid,51.21497,4.43086,Entire home/apt,50,3,2,2020-07-30,0.20,1,0
42499217,Granny's Ground Floor Room,1820186,Fronk & Lieve,,Deurne Oost,51.22076,4.47845,Private room,15,7,0,,,6,365
42508383,Modern room in Antwerp city with balcony,143264245,Pablo,,Haringrode,51.20041,4.41681,Private room,29,7,1,2020-05-03,0.12,1,30
42529502,The Capital Street Lodge,165436938,Elisabeth,,Historisch Centrum,51.21906,4.39777,Entire home/apt,63,1,8,2020-11-20,0.82,32,363
42529654,The Capital Street Triplex,317037207,Elisabeth,,Historisch Centrum,51.21992,4.39866,Entire home/apt,46,1,4,2020-09-12,0.39,32,364
42531486,Kamer in rustige straat van het oude centrum,37228775,Jules,,Theaterbuurt-Meir,51.2172,4.403,Private room,60,1,2,2020-10-18,0.35,2,67
42550410,The Lily Lodge Heart of Antwerp,165436938,Elisabeth,,Universiteitsbuurt,51.22015,4.41033,Entire home/apt,63,1,3,2020-11-11,0.44,32,358
42550684,The Lily Lodge in The Heart of Antwerp,317037207,Elisabeth,,Theaterbuurt-Meir,51.2189,4.41015,Entire home/apt,63,1,8,2020-11-13,1.32,32,1
42579650,The Hendrik House in The Heart of Antwerp,165436938,Elisabeth,,Historisch Centrum,51.22031,4.40503,Entire home/apt,46,1,8,2020-10-04,0.86,32,332
42580071,The Hendrik Lodge in Heart of Antwerp,317037207,Elisabeth,,Historisch Centrum,51.22031,4.4051,Entire home/apt,63,1,1,2020-09-18,0.29,32,331
42619796,Modern Penthouse apartment with Skyline View,43578172,Pascal,,Theaterbuurt-Meir,51.21789,4.41433,Entire home/apt,64,2,7,2020-10-06,1.03,3,177
42619958,The Operahouse -  Antwerp  in Style & with a View,43578172,Pascal,,Theaterbuurt-Meir,51.21933,4.41455,Entire home/apt,64,2,10,2020-10-06,1.55,3,145
42635704,Volledig nieuw centraal gelegen studio,12803536,Malika,,Amandus - Atheneum,51.22199,4.42131,Entire home/apt,45,2,1,2020-08-04,0.20,1,0
42654607,Short/long term  one-room expat flat with terrace,244855772,Greg,,Stadspark,51.20757,4.41436,Entire home/apt,80,2,0,,,2,0
42661008,Super cozy studio with amazing Kingsize bed,44766240,Christine,,Deurne Zuid West,51.20863,4.45688,Entire home/apt,37,2,8,2020-12-25,0.84,1,0
42679912,Toffe flat vlakbij Centraal Station en centrum,24288412,Mariam,,Amandus - Atheneum,51.22178,4.42244,Entire home/apt,49,1,4,2020-07-29,0.74,1,58
42684801,Cosy mezzanine @ Antwerpen Zuid,11876676,Eli,,Brederode,51.20266,4.39249,Private room,30,2,1,2020-03-04,0.10,1,0
42732622,Business apartment Deurne,60219699,Eugene,,Deurne Noord,51.23321,4.44982,Entire home/apt,79,2,1,2020-07-17,0.18,23,1
42732928,"Gelijkvloers appartement, modern ingericht",339542165,Anita,,Oud - Merksem,51.24256,4.44293,Entire home/apt,50,2,1,2020-03-16,0.10,1,267
42755119,TOMORROWLAND - SPACIOUS ANTWERP ROOFTOP APARTMENT,119686519,Mo & Noemi,,Deurne Zuid Oost,51.20242,4.46385,Entire home/apt,582,3,0,,,1,307
42759117,Zonnig appartement in het bruisende Antwerpen Zuid,76315349,Margot,,Harmonie,51.20911,4.40375,Entire home/apt,85,2,0,,,1,180
42778069,Heart of Antwerpen,60219699,Eugene,,Historisch Centrum,51.21874,4.40276,Entire home/apt,150,2,0,,,23,1
42788327,The Artist's Suite,15780894,Simon,,Universiteitsbuurt,51.22379,4.40672,Private room,42,1,29,2020-11-27,2.97,7,31
42791559,"Dé Studio, oase van rust en romantiek in de stad.",6091257,Nele,,Theaterbuurt-Meir,51.212,4.40674,Entire home/apt,70,1,1,2020-11-30,1,2,331
42803474,COSY DOUBLE ROOM @ LOVELY HOMELIKE RumpusRoom B&B,15842352,Ina - RumpusRoom,,Borgerhout Intra Muros Zuid,51.21209,4.43734,Private room,79,1,2,2020-12-23,0.32,9,38
42805423,"""Maison Philippe"" Luxury, Comfy Meir City Center❤️",10283752,Philippe,,Theaterbuurt-Meir,51.21697,4.40741,Entire home/apt,118,2,18,2020-10-31,1.84,2,87
42806260,CHARMING PRIVATE ROOM @ HOMEY COMFY RumpusRoom B&B,15842352,Ina - RumpusRoom,,Borgerhout Intra Muros Zuid,51.21396,4.43703,Private room,89,1,1,2020-07-02,0.16,9,37
42826391,APARTMENT in the heart of Antwerp!,174932988,Olivier,,Theaterbuurt-Meir,51.21588,4.41041,Entire home/apt,88,2,3,2020-07-31,0.51,5,89
42830084,Nice cute studio next to the city park,8136924,Roger,,Stadspark,51.20987,4.41328,Entire home/apt,65,1,0,,,4,179
42830430,Cozy & perfectly situated apartment in Zurenborg,8129669,Nicolas,,Oud - Berchem,51.20273,4.43408,Entire home/apt,39,13,0,,,1,1
42833232,Cosy top Floor apartment,154660833,Karin,,Zuid,51.20825,4.39526,Entire home/apt,32,30,1,2020-12-13,1,3,64
42859867,Appartement met loft gevoel,93455853,Pascal,,Theaterbuurt-Meir,51.21371,4.40345,Entire home/apt,90,1,0,,,2,304
42894599,Coolest room you’ll ever stay in - center Antwerp!,182678477,Driss,,Theaterbuurt-Meir,51.21462,4.40849,Entire home/apt,96,1,1,2020-07-19,0.18,8,177
42923960,Klein appartement in Antwerpen Centrum,60756836,Ann,,Brederode,51.20323,4.39703,Entire home/apt,52,21,0,,,11,364
42946563,Newly renovated house in Merksem,264440567,Henry,,Oud - Merksem,51.24649,4.44735,Entire home/apt,242,15,0,,,8,363
42958788,St-Jacobs Luxury Lodge,165436938,Elisabeth,,Universiteitsbuurt,51.22056,4.41411,Entire home/apt,51,1,3,2020-10-04,0.41,32,1
42958930,St-Jacobs Luxury Loft in The Heart of Antwerp,317037207,Elisabeth,,Universiteitsbuurt,51.22034,4.41434,Entire home/apt,59,1,30,2020-12-06,4.07,32,357
42973949,New apartment in the heart of Antwerp,222165629,Louis,,Theaterbuurt-Meir,51.2137,4.40955,Entire home/apt,105,2,2,2020-12-13,0.44,1,240
42981484,Apt. 9 Nick's place in the heart of Antwerp,341953444,Nick,,Stadspark,51.20571,4.41467,Private room,26,1,6,2020-10-07,0.96,7,0
42987313,Apt.11 Nick's place in the heart of Antwerp,341953444,Nick,,Stadspark,51.20566,4.41401,Private room,30,1,2,2020-09-26,0.39,7,90
43040299,"Spacious, bright apartment near the station",95317388,Dennis,,Borgerhout Intra Muros Zuid,51.21509,4.43024,Entire home/apt,80,2,2,2020-10-06,0.38,2,174
43111651,Central Park Apartments 2,60219699,Eugene,,Stadspark,51.20475,4.41596,Entire home/apt,75,5,1,2020-08-04,0.20,23,1
43111731,Central Park apartments 3,60219699,Eugene,,Haringrode,51.20462,4.41742,Entire home/apt,75,2,0,,,23,365
43136840,New group house @Antwerp,61620323,Patrick,,Harmonie,51.20787,4.40357,Entire home/apt,315,2,1,2020-06-14,0.15,1,88
43138786,Riverside Loft 150m²,61362648,William,,Linkeroever,51.23351,4.38551,Entire home/apt,139,1,2,2020-08-20,0.35,1,361
43168834,Cosy appartment with sunny terrace (incl. parking),190301328,Seppe,,Stadspark,51.2094,4.42086,Entire home/apt,79,2,7,2020-10-04,1.01,1,87
43227407,Private apartment in green neighborhood in Antwerp,29882794,Ans,,Deurne Zuid West,51.19606,4.45896,Entire home/apt,80,2,5,2020-11-12,0.84,1,0
43229299,Vintage City house Antwerp,344239401,Inge,,Zurenborg,51.20818,4.42805,Entire home/apt,68,2,5,2020-12-30,0.93,1,0
43246975,Business apartments,60219699,Eugene,,Deurne Noord,51.2321,4.45085,Entire home/apt,79,2,0,,,23,362
43263366,Grotemarkt - Penthouse (max6 persons),277645495,Daily,,Historisch Centrum,51.22031,4.39764,Entire home/apt,73,1,12,2020-11-02,1.76,8,173
43263535,Beautiful 2 bdr apartment in the centrum,277645495,Daily,,Historisch Centrum,51.22165,4.39801,Entire home/apt,69,1,7,2020-11-15,1.03,8,173
43309405,"Anvers: apart comfort 2 chambres, avec parking",2528396,Shana,,Deurne Zuid West,51.21128,4.4623,Entire home/apt,65,2,1,2020-05-08,0.13,1,1
43322144,"Gedeelde kamer in ruim, licht appartement.",95317388,Dennis,,Borgerhout Intra Muros Zuid,51.21513,4.42974,Shared room,45,2,0,,,2,0
43340297,"Studio in nieuw studentengebouw, GLV op Nieuw Zuid",60756836,Ann,,Nieuw - Zuid,51.20628,4.38633,Entire home/apt,50,125,0,,,11,183
43341118,Renovated flat with an amazing view near Antwerp!,121919008,Christophe,,Nieuw - Kwartier Oost,51.17898,4.43145,Private room,25,1,1,2020-06-20,0.15,2,169
43344347,Private room close to Berchem station,108667476,Rashid,,Groenenhoek,51.20327,4.44183,Private room,25,1,0,,,1,0
43390696,Gerenoveerde appartement,345609385,Gabriele,,Amandus - Atheneum,51.22323,4.42331,Entire home/apt,65,2,0,,,1,365
43396485,Apt. 8 Nick's place in the heart of Antwerp,341953444,Nick,,Stadspark,51.20771,4.41397,Private room,31,1,4,2020-10-05,0.54,7,90
43396672,Apt.17 Nick's place in the heart of Antwerp,341953444,Nick,,Stadspark,51.20757,4.41477,Private room,31,1,0,,,7,90
43397078,Apt.12 Nick's place in the heart of Antwerp,341953444,Nick,,Stadspark,51.20682,4.41376,Private room,31,1,9,2020-10-21,1.61,7,89
43397158,Apt.18 Nick's place in the heart of Antwerp!,341953444,Nick,,Stadspark,51.20743,4.41558,Private room,31,1,5,2020-09-16,0.78,7,90
43399763,Unieke 180 m2 Loft in het centrum van Antwerpen,46012419,Frank,,Universiteitsbuurt,51.2198,4.41417,Entire home/apt,140,2,0,,,1,270
43430557,Room in Family Home,1820186,Fronk & Lieve,,Borgerhout Intra Muros Noord,51.21576,4.43219,Private room,30,1,2,2020-12-04,0.56,6,365
43442604,BED in FUNKY COMFY 6-bed FEMALE DORM – bed 1,15842352,Ina - RumpusRoom,,Borgerhout Intra Muros Zuid,51.21249,4.43666,Shared room,29,1,0,,,9,102
43448028,BED in FUNKY COMFY 6-bed FEMALE DORM – bed 2,15842352,Ina - RumpusRoom,,Borgerhout Intra Muros Zuid,51.21367,4.43521,Shared room,29,1,0,,,9,102
43448444,BED in FUNKY COMFY 6-bed FEMALE DORM – bed 3,15842352,Ina - RumpusRoom,,Borgerhout Intra Muros Zuid,51.21187,4.43556,Shared room,29,1,0,,,9,102
43448623,BED in FUNKY COMFY 6-bed FEMALE DORM – bed 5,15842352,Ina - RumpusRoom,,Borgerhout Intra Muros Zuid,51.21232,4.43668,Shared room,29,1,0,,,9,102
43448629,BED in FUNKY COMFY 6-bed FEMALE DORM – bed 4,15842352,Ina - RumpusRoom,,Borgerhout Intra Muros Zuid,51.21362,4.437,Shared room,29,1,0,,,9,102
43448847,BED in FUNKY COMFY 6-bed FEMALE DORM – bed 6,15842352,Ina - RumpusRoom,,Borgerhout Intra Muros Zuid,51.21239,4.43566,Shared room,29,1,0,,,9,102
43478187,Apt.20 Nick's place in the heart of Antwerp,341953444,Nick,,Stadspark,51.2061,4.41381,Private room,26,1,3,2020-09-17,0.40,7,91
43494369,Bright and trendy apartment with sunny terrace,89656980,Arthur,,Amandus - Atheneum,51.22153,4.41947,Entire home/apt,65,2,6,2020-12-06,1.04,1,44
43506544,Trendy appartement aan ‘Nieuw Zuid’ te Antwerpen,345602301,Maati,,Nieuw - Zuid,51.20543,4.38251,Entire home/apt,87,2,3,2020-10-31,0.57,1,363
43544200,Appartement met uniek uitzicht op Kathedraal,347559714,Julien,,Historisch Centrum,51.22018,4.39858,Entire home/apt,60,4,0,,,1,71
43567032,Private Grand Residence | Atelier Wits,39001675,Guus,,Valaar,51.18301,4.38011,Entire home/apt,86,2,1,2020-10-11,0.36,3,356
43575983,Private room with Tv Room (3th) + free parking,42024170,Kristof,,Deurne Noord,51.23557,4.45353,Private room,24,1,4,2020-07-24,0.60,2,0
43584824,Riant achterhuis met zuiderse tuin en dakterras,2426371,Pieter,,Borgerhout Intra Muros Zuid,51.21538,4.42892,Entire home/apt,220,3,0,,,1,88
43601326,Stunning loft in the heart of Meir shopping area,338732492,Venko,,Theaterbuurt-Meir,51.21785,4.41309,Entire home/apt,130,1,3,2020-11-01,0.81,1,88
43660245,CHEERFUL and SUNNY FRIEND/FAMILY ROOM,15842352,Ina - RumpusRoom,,Borgerhout Intra Muros Zuid,51.21233,4.43709,Private room,169,1,0,,,9,205
43662809,Mies Van de Rohe kamer net aan het park,348693119,Kava,,Hoogte,51.18344,4.39459,Private room,90,2,0,,,3,365
43663388,Arne Jacobsen familiekamer net bij het park,348693119,Kava,,Hoogte,51.1828,4.39481,Private room,100,2,1,2020-07-19,0.18,3,0
43663664,Ray and Charles Eames kamer nabij het park,348693119,Kava,,Middelheim,51.18406,4.39621,Private room,85,2,0,,,3,364
